title,text,summary,keywords,authors
"“American people support me, not you!”: Bernie Sanders confronts Lindsey Graham at Fox News debate","In an Oxford-style debate Monday with Republican Sen. Lindsey Graham, Sen. Bernie Sanders argued that progressive policy goals such as Medicare for All, Social Security expansion, and a higher minimum wage are ""what the American people want"" and blasted the political establishment—including his GOP colleague—for ignoring the most important crises facing the United States, from the climate emergency to obscene levels of economic inequality.

""That's what the establishment does, and Lindsey is a very good and effective representation of the establishment,"" Sanders said after Graham delivered his opening remarks of the debate, which was held at the Edward M. Kennedy Institute in Boston and streamed live by Fox Nation. ""Does Lindsey have a concern that we are the only major country on Earth not to guarantee healthcare to all people? That some 60,000 people a year die because they don't get to a doctor on time? I didn't hear much about that in that opening statement.""

""Does Lindsey care that we have the highest prices in the world for prescription drugs, and that the pharmaceutical industry right now has 1,500 paid lobbyists in Washington, D.C. to make sure that in some cases we pay 10 times more for the medicine that we need?"" Sanders asked. ""Did Lindsey talk about the fact that we have, in South Carolina and all over this country, tens of millions of workers working for starvation wages? Did he talk about a corrupt political system in which billionaires today can start a super PAC—and I guess you have some familiarity with super PACs, they help fund your campaign—who can spend unlimited amounts of money to elect candidates.""

""I didn't hear Lindsey talk about the crisis of climate change,"" the Vermont senator continued. ""Do you have a concern that two people own more wealth than the bottom 42%? ... Bottom line is: we are moving toward oligarchy. And if we don't stand up and say that we need a government that represents working people and the middle class, I worry very much about the future of this country.""

Watch:

Sanders, who has appeared on Fox News several times in recent years to counter right-wing narratives and make the case for a progressive agenda, did so again during Monday's event, forcefully dismissing Graham's attempt to cast basic and popular policy objectives as ""full-on socialism"" and detached from public sentiment.

""The policies that I advocate are taking place all over the world,"" countered Sanders, who identifies as a democratic socialist. ""I would like to ask Senator Graham: Do you think raising the minimum wage to $15 an hour is socialistic? Do you think doing what every other major country on Earth does—guaranteeing healthcare to all people—is socialistic? Do you think expanding Medicare to cover dental care is quite socialistic?""

""I think we should increase benefits for Social Security recipients by lifting the cap... is that socialistic?"" he continued. ""Is making sure that all of our kids are able to get a higher education, is that socialistic? Is saying that three Wall Street companies should not control $20 trillion in assets, and we gotta break them up, is that socialistic?... Take a look at the issues we are fighting for: on every one of those issues, Lindsey, guess what, the American people support me, not you.""",,[],[]
"After bushfires and floods, will Australians step up and vote for climate action?","In just two days, Australian voters go to the polls to vote for their next government - but will they prioritise climate leadership or their economic reliance on fossil fuels?

Australia is one of the world’s worst offenders for carbon emissions per capita. The country is responsible for 1 per cent of greenhouse gases, a figure that rises to 3.6 per cent with their fossil fuel exports factored in. For a nation with only 0.3 per cent of the world’s population, this is a massive amount; nearly three times the average for other G20 countries.

The consequences of their carbon-intensive industries are right on their door step., This year ‘once in a generation’ (hopefully) floods occurred in eastern Australia, and who could forget the ‘black summer’ of 2020 which saw wildfires ravage the countryside and darken the skies of Sydney.

Given the disjuncture between the government’s approach to emissions and the very real dangers faced by the Australian population, it’s no surprise that voters are concerned.

A majority in parliament’s lower house is needed by one party - or a coalition - to pass legislation. Current Prime Minister Scott Morrison’s Liberal-National coalition has been in power for a decade, with the main opposition party, Labor, vying for control.

Meanwhile, the Green party have seen an uptick in popularity due to increased concern over global heating, and a rag tag group of high-profile challengers to the Liberals, called the Teal Independents, are hoping to make a dent in Morisson’s majority.

However with many swing seats in coal mining areas and a strong fossil fuel lobby, can the country vote in a government that’s progressive on climate? Let’s take a look at what’s at stake.

1 - Differing commitments to netzero

Prime Minister Scott Morisson has set targets to meet netzero that have been met with derision in some quarters AP Photo/Mick Tsikas

Morrison came under considerable international pressure for his perceived lack of enthusiasm for COP26 in Glasgow last year. It was only shortly before the major climate conference that Morrison finally announced a commitment to netzero by 2050. He has also drawn ire for the goal of only a 26 - 27 per cent cut by 2030, which would equal half that of the UK and US commitments.

Meanwhile the Labor party is aiming for a 43 per cent cut in the same time frame, contrasting themselves with Morrison’s coalition in taking climate change more seriously. Labor claims this will be consistent with 1.6C - 1.7C increases in temperatures as set out by the Intergovernmental Panel on Climate Change (IPCC).

The Greens are unsurprisingly pushing the envelope further and promising a 75% cut in emissions by the end of the decade, with the Teal Independents goal set as 50 - 60%.

Meanwhile the far-right One Nation party are proud climate sceptics and want an end to emissions targets.

It’s widely accepted that high-emitting countries like Australia and those in Europe and North America must cut their emissions by two thirds before 2030 in order to limit global temperature increases to 1.5C above preindustrial levels.

2 - Green infrastructure

Solar power could be a key stone in fighting climate change in Australia American Public Power Association

A shift to netzero means a shift away from power stations and coal, difficult given Australia’s reliance on the dirtiest fossil fuel for 70 per cent of its electricity as well as exports.

However, as President Biden was keen to point out to the American public in 2020, the green transition can mean jobs, jobs, jobs! A sentiment Australian politicians have taken forward as they try to woo swing voters.

In Monash, an agricultural area east of Melbourne, candidates are vying to put forward plans to both slash emissions and stimulate the regional economy.

Labor is focused on establishing a hotbed of hydrogen industry in the area while the Liberal party have highlighted a €1.3 billion spending commitment to renewable energy. Meanwhile an independent candidate has said they will provide investment to boost wind, hydro, and solar power.

Elsewhere on a visit to Newcastle, Morrison pledged €33 million investment to help create jobs and develop world-leading technology in solar, hydrogen, storage and green metals.

Both the Liberal and Labor emissions targets rely heavily on technological solutions like carbon capture and hydrogen, rather than cutting emissions at their source.

3- Coal mines

An operating coal mine outside Narrabi, Australia. Neither of the main parties have committed to ending coal mining before 2030. Rob Griffith/AP

Coal mining is big business in Australia, providing around one-tenth of gross domestic product and dominating whole regions.

According to the Lowy Institute 55 per cent of Australians want the government’s main priority on energy policy to be reducing carbon emissions. However, the country’s reliance on coal means that 30,000 jobs stand to be lost by eliminating fossil fuels, according to the Centre for Policy Development, creating a difficult bind for politicians.

Neither Labor nor the Liberal-National coalition have pledged to close coal mines, pointing rather to a policy of naturally shifting away from coal as the market demand decreases. Meanwhile, 114 new coal and gas projects are in the government pipeline and if all of these are carried out, the country’s emissions would increase by 250 per cent.

So far the Greens are the only party to pledge to end burning, exporting, and mining of thermal coal by 2030, in line with their pledge to be carbon neutral by 2035.

6 - The Pacific

A cyclone hits Fiji: Extreme weather is set to be a big problem for the Pacific islands Brett Phibbs/AP

Shock greeted a recent revelation that China has signed a security deal with the Solomon Islands, with the opposition Labor party accusing Prime Minister Scott Morrison of dropping the ball on Australia’s leadership in the Pacific.

Climate change poses an existential threat to the island nations of the Pacific, with low-lying countries like Tuvalu already disappearing due to rising sea-levels, and an increase in cyclones and extreme weather also battering larger nations like Fiji.

Labor has pledged over €350 million in development aid to the Pacific region, with some earmarked for patrolling illegal fishing and helping Pacific nations to tackle climate change, including disaster relief centres.

The plan, which Liberal leader Scott Morisson says builds on existing policy, would also see the creation of a Pacific climate infrastructure financing partnership to support clean energy infrastructure.",,[],[]
"North India’s hills are feeling the heat too, but differently","India recorded the hottest March in 122 years and since then, there has been hardly any relief from heatwave conditions.

To seek relief from severe heat, tens of thousands of tourists either visited or are going to the hill stations in northern India, causing massive traffic jams.

The rush of tourists from plains to hills has highlighted environmental issues plaguing the fragile Himalayas ecosystem such as water shortage and plastic pollution.

Experts say that tourism beyond the carrying capacity of such ecologically sensitive regions could cause irreversibly harm to the fragile ecosystem of these areas.

“No winter lasts forever; no spring skips its turn,” says author Hal Borland. But it seems in 2022, spring forgot its annual appointment with northern India as a usually pleasant March was replaced by an unusually hot March, which was the hottest in the last 122 years. In fact, on May 15, Delhi experienced the hottest day of the season with mercury crossing 49 degrees Celsius.

So, while the plains were burning and there was hardly any relief from the scorching sun, tens of thousands of tourists either visited or are planning to go to hill stations in Jammu and Kashmir, Uttarakhand and Himachal Pradesh. This has caused massive traffic jams and many experts say that tourism beyond the carrying capacity of such ecologically sensitive regions could cause irreversibly harm to the fragile ecosystem of these areas.

Raghu Chowdhary, CEO of Wowidays Hospitality and Tourism Pvt Ltd, said, “We usually count May and June as the peak season for summer holidays booking … but we saw a 200 percent increase in footfalls in March and April 2022 compared to last year.” He cited ‘revenge travel‘ and the early arrival of high temperatures for the skyrocketing demand in travel bookings to the Himalayan states of India.

According to him, the pent-up demand for travel due to COVID-19 restrictions last year changed people’s mindsets. “Now, people are not hesitating in spending money on domestic travel. They are choosing domestic travel over international,” Chowdhary shared.

He informed that Indians, in some instances, are now booking a Mumbai- Srinagar flight for as high as Rs. 50,000, which is more than double the average cost, and are even spending Rs. 500,000-600,000 on a domestic trip. “This wasn’t the case earlier. They don’t even mind travelling in the so-called offseason,” he added.

Chowdhary’s claim is supported by the official numbers released by Jammu and Kashmir Tourism Department. The month of April recorded a footfall of around 413,198 visitors arriving at Srinagar International Airport, with 2,909 flight movements. The first week of May alone saw an inflow of 33,000 tourists. “Kashmir is witnessing a record footfall of tourists this year. We are thrilled to say that after two lean seasons, the valley saw more than 700,000 visitors, the highest in the last thirty years,” said Shaqoor Sheikh, the owner of Srinagar-based Nishat Tours and Travels.

The sharp tourism uptick is not limited to Kashmir alone. Tourist destinations in northern India such as Haridwar, Rishikesh, Shimla, Manali, Mussoorie, Nainital, and Dalhousie are packed with tourists. Hotels and homestays are running close to 100 percent capacity – weeks earlier than the usual peak season of mid-to-late May.

“The total population of Tehri is just 24,000, but we saw more than 100,000 tourists during the Good Friday long weekend,” said Avnish Dimri, a local resident of the Tehri region. According to him, there wasn’t a single room free that weekend, and ever since the heatwave intensified in the plains, the rush to the mountains has increased manifold.

The sharp rise in tourist arrivals is expected to rise further. Search queries and bookings for May-June have grown by 200 percent and 40 percent, respectively, compared to January-March, according to data from leading travel booking platforms and domestic airlines. Local travel authorities and people engaged in the tourism industry share a similar sentiment.

Rishi Raj Singh, the CEO of Kaudia Estate, states, “We are a luxury villa (Rs. 85,000 per night charge) based out of a slightly obscure place in Kanatal (Tehri Garhwal district of Uttarakhand). Yet we are completely sold out until June. We are forced to refuse new bookings. We have never seen this kind of demand.”

Read more: Climate change hits home as increasing heatwave days scorch India

Heatwave spiked pilgrimage too

Besides travelling for leisure, the heat has also caused a spike in pilgrims registering for the Char Dham Yatra in Uttarakhand. Harish Gaur, media in charge of the Badrinath-Kedarnath Temple Committee, said, 775,842 pilgrims undertook the Char Dham Yatra, visiting the shrines of Badrinath, Kedarnath, Gangotri and Yamunotri in Uttarakhand, till May 20. This number is relatively high compared to last year’s number of pilgrims – about 500,000. The number is expected to increase further as the local administration has been asked to be prepared to handle over two million cars in the yatra months (May-October). At the moment, the yatra registrations have already been closed until June 1, 2022.

While the travel industry is happy with the booming travel business, many are worried about the burgeoning problem of over-tourism. “All top hotels in Kashmir are booked till June. Rates have increased by thrice, yet tourists are suffering. The overall service has gone down because the demand is higher than the supply. There is a shortage of hotels, cars, and shikaras,” said travel and tour company owner Sheikh from Kashmir.

Chaman Panwar, a travel and tour operator based out of Delhi, said the taxi demand to Uttarakhand and Himachal has gone up significantly since April 2022. There are no taxis available, and his drivers often complain about long traffic jams that have become a common phenomenon in hills this year. “Earlier traffic jams used to happen during key holiday dates but now getting stuck for 2-3 hours in a 14-15 km jam has become a regular thing for my drivers during the Yatra season,” said Panwar. The rush has led to other issues related to parking, stay and fuel as well.

Amritabh Mukherjee, a tourist from Delhi, said he went to Kasauli with his friends to escape the heat and long weekend holiday crowd. “We deliberately planned our holiday in the week of April 22 to avoid the holiday rush of Good Friday long weekend (April 15-17). But to our surprise, we still got stuck in a two-hour-long traffic jam at 1:30 am on the Delhi-Chandigarh highway. And, traffic wasn’t the only issue, we couldn’t even find a hotel to stay in the main town. So, we had to stay two km before the Kasauli town,” Mukherjee said.

Whether it is Uttarakhand, Kashmir, Himachal or Ladakh, traffic jams seem to have become a constant feature in all the hill stations. Sheetal who works at the Prakriti Resort in Gangotri said the government advertised Char Dham Yatra in a big way but didn’t put systems in place to handle the large crowds.

“We have guests that have booked their yatra since 2020, and they are facing problems in getting registrations for darshan. Tourists are disappointed with the local government’s inability to handle the situation,” she said while informing that prices have shot up, and traffic jams have become a daily routine – Uttarkashi to Gangotri stretch that took 2-3 hours now takes more than 6 hours to cross.

The collapse of the ecosystem in hill stations raises concern

The rush from plains to hills has also added to environmental woes such as damage to the fragile mountainous ecosystem, water shortage and plastic pollution.

“As tourism is a big industry, little or no attention is given to the environmental damage it does. Most people don’t adhere to norms on waste disposal, and so many vehicles coming increases ambient air pollution levels. Even the local hotels and homestays don’t follow the right waste disposal practices. We collect tons of plastic waste from pristine hills every year,” said Avnish Dimri.

Avnish, Shaqoor, and Sheetal all resonate with the same point – waste disposal has become all-pervasive.

In fact, a 2021 report by the Intergovernmental Panel on Climate Change emphasises that going forward. mountain regions will be more prone to glacier lake outburst floods like the Chamoli disaster in Uttarakhand and cloudburst-like rains in Himachal Pradesh. The report states that rising temperature and melting glaciers will also have a severe impact on the global plant and animal species that have been already reeling under the effects of heatwaves, droughts, wildfires and floods.

The 2022 IPCC report further paints a worrying picture. It notes that climate change will increase in all regions in the coming decades, especially in South Asia and there will be an increase in heat waves, longer warm seasons and shorter cold seasons.

Krishna AchutaRao, a climate scientist from the Centre for Atmospheric Sciences at the Indian Institute of Technology, Delhi, who has been researching climate change since the 1990s, told Mongabay-India that “the current heatwave is consistent with what has been predicted under the climate change impact. What India is experiencing currently is due to warming of the earth.”

He warned that the worse is yet to come and said “as the earth warms, you can see more heat extremes happen. And, we will witness heat extremes occurring earlier to the season than we are used to – like this year, March-April witnessed the kind of heat we expect in May-June.”

Sharing the direct correlation between climate change and heatwaves, AchutaRao explained, “Over the last 20-30 years, we have witnessed increasing temperatures and the steady increase in heatwaves – the number of heatwaves, their duration and the intensity has been growing. In 2015, a severe heatwave killed over 2,500 people. Unsurprisingly, the number of heatwaves and heatwave-related mortalities is increasing. Anybody who can’t see the direct link between heat waves extremes and climate change has not followed the science.”

The residents, scientists and the travel community share a similar sentiment that the current state of tourism in the hills of northern India makes things very difficult. A long-term strategy to mitigate the impending disasters of climate change and over-tourism is urgently required.

Banner image: Traffic jam at Saribal. The traffic jams have increased manifold in Kashmir due to tourist rush. Photo by Mike Prince/ Wikimedia Commons.",,[],['Mayank Aggarwal']
Continental Resources Stock: Harold Hamm’s Deal Ushers In Oil’s Last Hurrah,"imaginima/E+ via Getty Images

By Breakingviews

Oil’s last hurrah wouldn’t be complete without Harold Hamm planting his flag on some of its mounds of cash. The shale pioneer wants to buy the remaining 17% of Continental Resources (CLR) his family doesn’t already own, valuing the entire firm at some $25 billion. The small premium – and outlook for oil prices in the medium term – means he can be a huge beneficiary of wells pumping cash as fossil fuels’ future wanes.

Companies like Continental, that slice through rock with sand and water to squeeze out oil and gas, have come into the firing line from investors who want to own more climate-friendly companies. Describing his bid in a letter to employees, Hamm said that private markets are a better place for companies like Continental, and there’s something to that sentiment. With U.S. President Joe Biden and others chastising industry executives for their business, it’s going to be hard to both make money and stay out of the limelight as a public firm.

It helps that the math of the deal works solidly in Hamm’s favor. Continental is expected to churn out $5 billion of net operating profit next year, according to Refinitiv. That means minority shareholders, with their 17% stake, have a claim to about $670 million of profit after tax, conservatively assuming they pay a 21% tax rate. That works out to a roughly 15% return, based on the price Hamm is paying.

Hamm may have to increase his offer. Continental shares were trading above the offer price of $70 a share Tuesday morning. Plus the premium is a miserly 9% to Friday’s close. While there’s no assurance oil prices will remain high, the return is nearly twice Continental’s cost of capital, according to Morningstar, leaving plenty of padding. Plus investors in larger firms like Chevron and Exxon Mobil are strongly encouraging oil firms to return cash, rather than invest it in new projects. This restraint supports higher oil prices and benefits firms like Continental.

Exploration and production companies are meant to mint more than $830 billion in free cash flow this year, a 70% increase from last year according to Rystad Energy, even assuming oil prices drop from their current level. Hamm and his wildcatter buddies aren’t going to want investors, authorities, or politicians dictating how they can spend that cash – or keep it for themselves. The best way to have the freedom to make those decisions is outside of the purview of the public market.

Original Post

Editor's Note: The summary bullets for this article were chosen by Seeking Alpha editors.",,[],[]
