title,text,summary,keywords,authors
‘Vicious cycle’: Storms intensify in the Gulf as climate changes,"Ecologically disastrous conditions in the Gulf are the latest sign of the dangers that climate change and other related factors pose to the Middle East.

In recent weeks, many in the Gulf have been looking up to an apocalyptic orange sky with a flurry of sand and dust storms (SDSs) battering the sub-region.

Construction of more dams, years of warfare, mismanagement of water, extreme dryness, desertification, and other factors all contribute to this nightmarish phenomenon.

In an increasingly climate-stressed planet, storms in these mostly desert countries, which exist in a dust belt, are set to intensify. What comes with these exacerbated ecological crises are increasingly dire threats to human health, economies, and security in the Gulf.

These transregional issues also have much potential to be a driver of future interstate conflicts across the greater Middle East.

Last month’s temporary closure of ports, airports, and schools in Iran, Iraq, and some Gulf Cooperation Council (GCC) states underscored the extent to which recent SDSs have taken a major toll on trade, travel, and daily life for the people of these countries.

Kuwait International Airport suspended all flights twice last month. On May 16, maritime operations in three Kuwaiti ports – Doha, Shuaiba, and Shuaikh – were suspended because of the climatic conditions. Sand and dust storms hit Riyadh and other parts of Saudi Arabia resulting in at least 1,200 people being hospitalised in the kingdom with breathing difficulties in May.

Dubai’s Burj Khalifa was not visible after a huge dust layer vanished the world’s tallest building.

In Tehran, authorities closed schools and government offices while there were dozens of flight delays or cancelations in western Iran. In Khuzestan, Iran’s hardest hit region, at least 800 people with breathing difficulties were forced to seek treatment.

Perhaps Iraq has been the country most vulnerable to sand and dust storms. Since March, there has been a storm hitting Iraq roughly every week, sending thousands of Iraqis to hospitals and the government declaring a national holiday to encourage residents and government workers to stay home. At facilities in certain parts of the country, Iraq’s health ministry even resorted to stockpiling oxygen canisters.

These ecologically disastrous conditions in the Gulf are merely the latest sign of the dangers that climate change and other related factors pose to the Middle East.

“In Gulf waters, SDSs are a main cause of sediments that can clog up nearby lakes and marshlands, and sometimes even cover large swathes of the Gulf waterway,” wrote Banafsheh Keynoush, a foreign affairs scholar and a fellow at the International Institute for Iranian Studies.

“Even renewable solar panels malfunction when covered by dust. Given these factors, it becomes evident that SDSs participate in a vicious cycle: Climate change causes the storms, and the storms exacerbate the impacts of climate change. Socio-economic life revolves around weather patterns, so livelihoods are severely threatened,” added Keynoush.

According to the World Bank, sand and dust storms in the Middle East come with an annual cost of $13bn. To be sure, such storms in the region constitute a transregional crisis. Mindful of the Middle East’s importance to the global economy from the standpoint of international trade via strategic waterways and energy supplies, countries far from the Gulf will pay a steeper price as the phenomenon exacerbates.

Opportunity for armed groups

Disturbingly, there is a growing threat of violence because of sand and dust storms. For years, the armed group ISIL (ISIS) in Iraq has exploited the lack of visibility resulting from these storms to carry out attacks with greater ease.

In May, ISIL carried out deadly attacks in Kirkuk and Diyala provinces, targeting farmers who were harvesting crops. In April, ISIL exploited the enormous storms to strike against the Iraqi army in al-Anbar province’s town of Hit, killing two soldiers.

Naturally, Iraq’s security forces will have difficulties coping with SDSs that leave them more exposed to future ISIL attacks. With this extreme weather requiring the military to put some of their operations and aerial support on hold, fighters will have an easier time exploiting these storms to wage more frequent attacks against the Iraqi military and civilians, particularly in more remote areas.

Beyond concerns about terrorism, experts warn these unusual storms have the potential to spur interstate conflicts in the region over water. Environmental crises related to low rainfall, drought, and declining river levels can serve to heighten tensions between countries.

Turkey’s damming of the Tigris and Euphrates rivers is one factor leading to more desertification in Iraq, where water resources have fallen 50 percent since 2021, with a backflow from the Gulf into Iraq’s mainland.

“Saltwater is actually coming in from the sea into freshwater areas,” Tallha Abdulrazaq, an expert in Middle Eastern strategic and security affairs, told Al Jazeera. “This is killing arable land, causing salinisation of soil, and ultimately leading to desertification.”

Iran’s digging of canals around the Bahmanshir River, a tributary to the Shatt-al-Arab, “has artificially altered the midpoint Thalweg line in the Shatt al-Arab, which historically – and particularly since the Algiers Accords – has demarcated the boundary between Iran and Iraq across the Shatt-al-Arab”, explained Abdulrazaq.

“Basically, the water line has been split down the middle between the two. By artificially altering this border, this can lead to a conflict not only over the borders and access to the Shatt-al-Arab, but also to pollution of Iraq’s water supply.”

Desertification

The issue of Turkey’s dams is also adding tension to Ankara’s relationship with Tehran with Iranian officials partly attributing their country’s drought to Turkey’s upstream dam-building.

On May 12, a spokesman for Turkey’s foreign ministry dismissed such accusations as “far from scientific”, while maintaining that Tehran is not taking a “realistic approach” to this problem by putting blame on Ankara’s doorstep.

As the sand and dust storms terrify people in Iraq and other countries of the region, the serious effects of desertification are only set to intensify while global warming has the potential to make decreases in rainfall more permanent with a devastating effect on the ecology.

Among other factors, these terrifying environmental issues can be drivers of future conflicts in the Middle East.",,[],['Giorgio Cafiero']
"In West Virginia, the clean-energy transition rests on Joe Manchin","Placeholder while article actions load

KEYSER, W.Va. — About a three-hour drive from the nation’s capital, the road snakes past a barren brown landscape where lush forests once stood. The mountains here have been gouged by heavy machinery and stripped of sugar maples, yellow birches and other trees native to this stretch of Mineral County.

Mining for coal, the rock that gave the county its name, helped scar this landscape. But now a row of spinning windmills dots a nearby ridge, as a developer bets that mounting concerns about climate change and the coal industry’s viability will speed an energy shift here.

Renewable energy has just begun to gain a foothold in West Virginia, accounting for 6 percent of the state’s electricity in 2020 compared with coal plants’ 88 percent. Residents’ deep skepticism about the transition to clean energy — even among those working on the new Black Rock wind farm — has complicated President Biden’s push to wean America off fossil fuels.

Advertisement

No figure in the country has more influence over the president’s effort than Sen. Joe Manchin III, the powerful West Virginia Democrat who chairs the Senate Energy and Natural Resources panel. Manchin supports Clearway Energy Group’s Black Rock wind farm, which will increase the state’s wind energy generation by 15 percent. But he helped scuttle Biden’s signature climate and social spending plan last year, arguing the sweeping legislation to cut carbon emissions would hurt his constituents.

Chuck Parker, an operating engineer who helped build the Black Rock wind farm, shares Manchin’s doubts about a rapid shift to clean energy. He worries many coal industry workers who have sacrificed their health and well-being to power the state won’t find well-paying jobs installing wind turbines like he did.

“I don’t think wind is a replacement for coal,” Parker said in an interview at the ribbon-cutting ceremony for the wind project in early May. “I think coal will always have a place in West Virginia, and it should. But wind is a great addition to our energy portfolio.”

Like Parker, Manchin recognizes the country’s inevitable embrace of clean-energy technologies such as wind turbines, solar panels and electric vehicles. But his continued opposition to sweeping climate measures stems, at least in part, from a fear of accelerating the transition at his home state’s expense, according to interviews with half a dozen people close to Manchin, including friends, lobbyists and West Virginia Democratic politicians.

Advertisement

“There are some on the left who believe people will suffer greatly if we don’t make this transition very, very quickly,” said one lobbyist, who like others spoke on the condition of anonymity to preserve their relationship with the senator. “Manchin believes people will suffer very greatly if we make it too quickly.”

“This is a problem with the Democratic Party,” this person added. “They are perfectly willing to sacrifice men 45 to 65 years old, who are just never gonna retrain to work in [electric] battery plants.”

Manchin spokeswoman Sam Runyon declined to make the senator available for an interview for this story.

“Senator Manchin continues to work towards solutions that shore up American energy security and reliability in the near term by using our abundant natural resources in the cleanest way possible, while also investing in technologies that reduce emissions and lead the global fight for innovative solutions to climate change,” Runyon said in an email.

‘He’s fighting them’

Biden’s social spending bill, formally known as the Build Back Better plan, contains a record $555 billion package of tax credits, grants and other policies aimed at cutting planet-warming emissions and boosting clean energy. The legislation would have helped Biden meet his goal of cutting the nation’s carbon emissions in half by 2030.

Advertisement

Frustration at Manchin has reached a fever pitch among climate activists, who blame him for blocking the biggest climate bill in U.S. history at a time when extreme drought, record-breaking heat and uncontrollable wildfires threaten wide swaths of the country.

Climate activists in kayaks — or “kayaktivists” — have staged several protests outside Manchin’s houseboat in Southwest D.C. Others have blocked the entrance to the West Virginia power plant tied to his family business, which has made millions by taking waste coal from long-abandoned mines.

When asked whether he has a conflict of interest, Manchin cites a blind trust to justify his voting record. But documents filed by the senator show the blind trust is much too small to account for all his reported earnings from the coal company.

Dave Scott, a fourth-grade teacher in Morgantown, W.Va., who participated in the protest at the coal plant, said he is “disgusted” by what he sees as Manchin’s blatant corruption, although the senator complies with congressional ethics and financial disclosure rules.

Advertisement

“I don’t believe that he’ll ever support anything on climate,” Scott said. “His wealth literally comes from releasing carbon dioxide into the atmosphere.”

But that sentiment is not shared widely in West Virginia, a deep-red state that Donald Trump easily carried in the 2020 presidential election with 68.62 percent of the vote. Many conservative voters here approve of Manchin, who they say is joining Republicans in thwarting Biden’s agenda.

“Joe Biden’s policies are going to make us in really bad shape,” Mary Dolly, a Republican who voted for Trump, said in an interview outside the Walmart in Keyser. “And Joe Manchin’s stopping them. He’s fighting them.”

Jean Weimer, another Trump supporter who was running errands at the store, agreed. “He’s been doing pretty good with the Republicans, so I appreciate that,” she said.

‘Joe forgot about us’

The competing pressures on Manchin stem not only from climate activists and conservatives, but also from factions within the coal industry.

Advertisement

Coal miners have urged the senator to support the social spending bill, which would extend an increased excise tax that funds benefits for miners suffering from black lung disease. Coal mine owners, however, oppose the legislation.

Roughly 25,000 coal miners suffer from black lung, which is caused by inhaling toxic coal and silica dust in underground mines. Doctors have not found a cure for the deadly disease, and Biden’s bill provides a four-year extension for a tax on coal sales funding benefits for sick miners.

Gary Hairston, president of the National Black Lung Association, worked in West Virginia coal mines for more than 27 years before retiring at age 48, when he was diagnosed with the disease. He and other advocates held a rally in Charleston, W.Va., last week to urge Manchin to support Build Back Better.

Advertisement

“It seems like Joe forgot about us,” Hairston, who has been prescribed oxygen and medication to keep his airways open, said in an interview. “He ain’t doing nothing for the coal miners at all.”

In a memo last month, the Labor Department noted that black lung patients will continue to receive benefits even if the excise tax is not extended. But it warned that the Treasury Department would need to borrow money to pay for them, meaning that “taxpayers are footing the bill for black lung benefits, not the coal mining industry.”

Manchin has introduced legislation to provide a 10-year extension of the black lung excise tax rate and will “continue to work to shore up the black lung excise tax to address the needs of our brave miners,” Runyon said.

West Virginia Coal Association President Chris Hamilton, whose group represents mine owners, argues that the administration’s proposal would take away the jobs of the same miners advocating for it.

Advertisement

“They’re Little League coaches. They’re Bible school teachers. They’re spouses or teachers or nurses,” Hamilton said. “I mean, they just make up such a huge portion of our nation’s industrial fabric. And to simply put them out of work or try to force them to take up some other occupation, in my opinion, it’s just extremely callous.”

Autumn Long, a project manager at the Appalachian Solar Finance Fund, which provides financial and technical assistance to solar energy projects in coal communities across Central Appalachia, disputed that notion.

“Not only is it possible for former workers in the coal industry to transition into clean-energy industries, it’s already happening in West Virginia,” Long said. “And I think it’s fair for the state to ask for the resources that we need to successfully make this transition to a 21st-century energy system and to not get left behind.”

Intraparty tensions

On Capitol Hill, Manchin has voted against Democrats’ efforts to not only combat climate change, but also codify the right to abortion and change Senate rules to pass a voting rights overhaul. His utterances have caused a near-daily headache for Senate Majority Leader Charles E. Schumer (D-N.Y.), who is responsible for shepherding Biden’s priorities through the evenly divided chamber.

Advertisement

Manchin grew frustrated in mid-December when Schumer publicly declared that the Senate would vote on the social spending bill before Christmas, according to two people familiar with the matter. That timeline was at odds with private assurances from Biden a day earlier that the negotiations would continue into January, they said.

The relationship between Manchin and Schumer has improved since that low point, they added. The two met in April to discuss strategies for getting inflation under control: Schumer described the meeting as “preliminary and good” and said the pair would continue talking.

National Economic Council Director Brian Deese, who plays a key role in legislative negotiations, visited West Virginia with Manchin in March. After going zip-lining with the senator near the New River Gorge, Deese took to Twitter to extoll the state.

“Coal and energy communities helped make America what it is, the strongest economy in the world and the global leader of democracy,” Deese wrote. “Nobody should forget that, and President Biden certainly doesn’t.”

The White House declined to comment for this story. When asked about Manchin last month, White House spokeswoman Karine Jean Pierre told reporters, “We’re just not going to negotiate in public.”

A ticking clock

Since negotiations over the spending bill collapsed, Manchin has been meeting with a small group of Republicans to discuss the possibility of a bipartisan energy package that could attract 10 GOP votes in the Senate. The push is typical of Manchin, who believes that reaching across the aisle leads to more durable policy, confidants said.

But his efforts to bridge the partisan divide have their limits, even in West Virginia. This month, Manchin backed Rep. David B. McKinley in the state’s GOP primary over Rep. Alex Mooney, whom Donald Trump endorsed. In a 30-second video ad, Manchin called it an “outright lie” that McKinley supported the Build Back Better bill, as Mooney and his supporters had claimed.

Last week, Mooney prevailed in the primary over McKinley, demonstrating Trump’s enduring appeal in West Virginia and signaling the dilemma Manchin could face if he runs for reelection in 2024.

Hoppy Kercheval, the longtime West Virginia radio host who often has Manchin on his show, noted that West Virginia Attorney General Patrick Morrisey (R) or Gov. Jim Justice (R) could pose a serious challenge.

“There is virtually no chance for a successful challenge to him from the left,” Kercheval said. “But West Virginia’s gone deep red, and there are several Republicans champing at the bit to run for the Senate in 2024.”

At the ribbon-cutting ceremony for the Black Rock wind farm, meanwhile, some investors argued that Manchin’s current approach could harm his state’s economy. Clearway Energy Group CEO Craig Cornelius declined to comment on the senator’s actions but warned that if Congress fails to extend the tax credits for clean energy, the company’s plans for additional West Virginia projects will suffer.

“Those incentives are the difference between whether a project gets built in the next two years or the next eight,” Cornelius said.

Manchin’s state projects coordinator, Keith McIntosh, hailed the Black Rock wind farm as a boon for West Virginia in brief remarks to the crowd of clean-energy advocates and state politicians.

“For generations, West Virginia has powered our nation to greatness,” McIntosh said in an apparent reference to coal mining. “And investments like this will ensure our state will remain an energy superpower for generations to come.”

GiftOutline Gift Article",,[],['Maxine Joselow']
