title,text,summary,keywords,authors
"Amazon is recruiting TikTokers, Stark is on a buying spree and more","Expecting parents often rely on Ikea for affordable nursery furniture—now they can turn to the Swedish home giant for baby name ideas, too. Whatever happens next, stay in the know with our weekly roundup of headlines, launches and events, recommended reading and more.

Business News

Recycled cotton company Recover has completed a $100 million fundraise, Home Textiles Today reports, thanks to an investment led by Goldman Sachs with participation from majority shareholder Story3 Capital Partners. Based in Spain, the fourth-generation family-owned company was founded in 1914 as a textile producer, before pivoting in 2006 to focus on converting textile waste into recycled cotton fiber for an end product that results in low operating costs and a minimal carbon footprint. With the new capital, the company plans to expand beyond its current manufacturing centers in Spain, Pakistan and Bangladesh, adding an additional location in Bangladesh and a new facility in Vietnam this year before shifting its focus to Asia and Latin America. As part of the deal, Goldman Sachs Asset Management’s managing director and chief sustainability officer Letitia Webster will join the board of directors at Recover, which is now valued at about $1.1 billion.

Luxury carpet and rug company Stark has acquired Minneapolis-based residential and commercial flooring provider Intersource, which will now be known as Intersource by Stark. Following the deal, the company’s showroom will remain in International Market Square, with plans to move into a new space in fall 2022. With both companies focusing on trade residential and commercial sales—specifically with a core client base of interior designers and specifiers—the acquisition allows both brands to expand their offerings through newly combined labor and resources. The move is Stark’s third buy of a regional floor-coverings company within the past year and a half—after the March 2021 purchase of New Jersey–based J&S Designer Flooring and the July 2021 purchase of Florida–based floor covering company Crystal Tree Carpet—and comes amid a period of growth that’s seen the company launch e-commerce venture Ashley Stark Home among other new collaborations and product offerings.

Builders are more backed up with projects now than they were a year ago, according to a new member survey conducted by Associated Builders and Contractors. The organization’s backlog indicator notched upward from 8.8 months in April to nine months in May—a projection that is up one month entirely from May 2021. Though they have plenty of work, contractors are losing some of their optimism. The survey indicated that confidence in future sales and staffing levels was declining slightly, and expectations around profit margin were taking a significant hit. According to ABC’s chief economist Anirban Basu, contractors will continue to face challenges surrounding the cost of delivering construction services due to the ongoing volatility of materials prices and supply chain delays—a factor that feeds into the survey’s less-than-ideal profit margin projection.

Habitat for Humanity International announced that it is dedicating more than $25 million in funding toward the goal of increasing the number of Black homeowners in the U.S., The Wall Street Journal reports. The nonprofit organization has set a goal of creating 3 million new Black homeowners by 2030 and will distribute funds to 1,100 local affiliates across the country. As part of the plan, Habitat for Humanity will also provide financial coaching to prospective homeowners and will back efforts to change laws in neighborhoods where multiunit homes are prohibited—a common obstacle for lower-income families seeking housing. According to chief executive officer Jonathan Reckford, the initiative is designed to target the historic and systemic discrimination preventing Black families from buying homes—in the first quarter of this year, the Black homeownership rate was 44.7 percent, while the white homeownership rate was 74 percent.

Rental costs are climbing quickly, rising by 5.2 percent in the year through May—a pace that’s keeping inflation high and making the transition to homeownership more difficult for renters, The New York Times reports. Since housing costs comprise a large part of the overall inflation index, they’re contributing to high prices even as the Federal Reserve raises interest rates to tamp inflation down—as a result, the market is likely to remain stretched for the near future. “Rent growth and occupancy are off of Everest peak and back at base camp, but we’re still a long way from the sea,” Igor Popov, chief economist at listing site Apartment List, told the NYT.

Amazon has gone to great lengths to recruit influencers from TikTok and bring them on to its own selling platform, Insider reports, including offering various creators between $2,000 to $9,000 per month (on top of standard commission rates) to create content on its live shopping feature, Amazon Live. As the article outlines, making the jump to Amazon was challenging: According to leaked documents and the experiences of participating TikTok users who spoke under condition of anonymity, many found it difficult to draw audiences from their native platforms to Amazon and also disliked that they had to spend their own money on products they bought and promoted in the live videos, rather than Amazon covering the costs.

Etsy has announced the launch of a new Purchase Protection program for both buyers and sellers on its platform, TechCrunch reports. The new feature rolls out on August 1, making buyers on the online marketplace eligible for a full refund for purchases that don’t match their description, arrive damaged or don’t arrive at all. Additionally, the company announced plans to invest at least $25 million in a program that will cover refunds on behalf of sellers for qualifying orders of up to $250, at no additional cost to sellers. The news comes just a few months after more than 14,000 of the platform’s sellers went on strike following Etsy’s announcement that it would be increasing transaction fees from 5 percent to 6.5 percent. According to the company’s launch announcement, the Purchase Protection program was the result of feedback from buyers and sellers.

Launches and Collaborations

The High Point Market Authority has released its biannual Style Report, a compilation of product insights from Spring High Point Market compiled by the 2022 Style Spotters—a group of designers chosen to expound on their favorite findings for the report. This season’s report placed a heavy emphasis on products and brands focused on sustainability and craftsmanship, with findings split into three categories: Behind the Scenes offers a glimpse at the story behind a product or brand; On the Scene features stories centered around a style, product category or other aesthetic theme; and Must Be Seen celebrates a beloved product, collection or brand.

Vancouver–based home brand Sundays is now available in the U.S. Courtesy of Sundays

Vancouver–based home brand Sundays has launched its offerings in the U.S. Founded in 2019 by Moe Samieian Jr., Sara Samieian, Barbora Samieian and Noah Morse, the company’s direct-to-consumer furniture and home decor products function individually or together as a curated room collection, with an array suitable to the bedroom, living room, kitchen, outdoors and more.

Interior designer and collector Kelly Wearstler and designer Hagit Pincovici have teamed up for the launch of Third Nature—a line of collectible furniture, sculptures and objets d’art. The collection began with Pincovici’s desire to reconnect with nature during the pandemic, at which time she began collecting dead plants found in her urban neighborhood and casting them in bronze in her Milan studio. Together with Wearstler, the pair developed custom furniture and decor items inspired by Pincovici’s original bronze designs—sculptural objects for the home such as a bench, console, chair, mirror and sculpture, all of which draw influence from the geographic similarities of each of their hometown cities, Los Angeles and Tel Aviv, respectively.

Chez Laurence, the series hosted by circularity design expert Laurence Carr, will return to EarthxTV for its second season, debuting on June 18. This season, Carr will highlight companies and organizations in the built environment, architecture, furnishings and design-related industries that have incorporated circular processes to reduce their environmental impact. Interviewees will include CEOs and executives from companies such as Moore & Giles, Verellen and the Sustainable Furnishings Council.

Showhouses

The Kips Bay Decorator Show House Dallas has announced the location for its third annual designer showhouse, selecting a property at 9250 Meadowbrook Drive in Old Preston Hollow. The 12,470-square-foot single-family home includes five bedrooms, eight bathrooms, an elevator, a four-car garage, a pool house apartment and more. In September, the residence will open to the public for tours to benefit local charities Dwell with Dignity and The Crystal Charity Ball.

Recommended Reading

A new breed of short-term rental properties is cropping up, with homeowners now booking their private residences by the hour for those seeking a stylish set or studio for photo shoots and other projects. For The New York Times, Katherine McLaughlin explores the phenomenon, which has taken off thanks to a platform called Peerspace—which saw a 300 percent increase in hosts between March 2021 and 2022—and has even spawned a lucrative new revenue stream for interior designers.

In 1971, the Johnson Publishing Company unveiled Ebony magazine’s test kitchen: a psychedelic space with Afrocentric prints, leather and ostrich feathers that was originally installed in the publication’s Chicago office—the first in the city designed by an African-American architect, John Warren Moutoussamy. Though the space was shuttered in 2010, as Nigel F. Maynard writes for AN Interior magazine, it returns this month for a public exhibition at the Museum of Food and Drink in Harlem, New York, where visitors will be able to view the design time capsule in person.

Cue the Applause

The winners of this year’s Architizer A+ Awards have been announced, recognizing the best in architecture and spaces in the largest program of its kind. This year’s honorees include the August Debouzy building in Paris by Studio Razavi Architecture as the jury winner and the 550 Madison lobby in New York by Gensler as the popular choice winner. For the full list of winners, click here.

The American Home Furnishings Hall of Fame Foundation has inducted five new members. Joining the cohort’s existing 126 members are Michael Amini, chairman and CEO of AICO/Amini Innovation Corp.; Michael K. Dugan, former president and CEO of Henredon Furniture Industries; John Gabbert, founder of Room & Board; Neil Goldberg, chairman and CEO of Raymour & Flanigan Furniture; and Stephen K. Pond, founding publisher of Furniture Today.

The International Interior Design Association of New York has chosen Jennifer Graham, principal and senior project manager at Perkins&Will, as this year’s recipient of the Leadership Award of Excellence. With 36 years of experience in the industry, Graham was selected for her commitment to upholding a positive work environment—as the leader of the Social Purpose program at Perkins&Will—and as a champion of education and mentorship in the design community, which she has exhibited as co-founder of the design nonprofit LMNOP, or Leadership, Mentoring & Networking Opportunities.

Homepage image: Interior designer and collector Kelly Wearstler and designer Hagit Pincovici have teamed up for the launch of Third Nature. | Courtesy of Hagit Pincovici",,[],['Caroline Bourque']
Paragon Textiles Finds Hot Used Clothing Markets,"Paragon Textiles is among those in the used clothing brokerage business, buying, sometimes repairing, then selling what thrift shops don’t want, and shipping them mainly to Africa and South America. At least that’s how Paragon Textiles CEO and owner Murtaza Haji got started in the 1990s, selling a few containers at a time.

Today the company works from a 42,000-square foot warehouse in Los Angeles, Calif. and procures, not just from secondhand shops, but also buys overstock and returns of a few retailers. Sometimes Paragon deals directly with the stores, and sometimes through brokers.

“We process and ship overseas to microentrepreneurs that start small clothing shops. Some leave their day jobs where they made the equivalent of a few hundred U.S. dollars a month. They realize they can buy product and make more money, selling one bale at a time,” Haji says.

The most ambitious small buyers and sellers earn up to thousands a month, according to Haji.

Paragon recycles, or else sells as wearable clothing, 97% of what it receives, most coming from thrift shops in roughly 40,000-pound bales; the Paragon team has no idea of what’s in them until they open them.

Paragon sorts it all, and it’s a complex process. First, workers separate in men’s’ ladies’, and children’s clothes, and by size, pulling out what’s not ripped or stained.

This usable clothing is the largest part of the mix and is what goes to the two main overseas markets. Some of the rest is cut into cleaning rags sold to U.S.-based companies that make wipers in bulk and supply them to end users. A small remainder is converted into other items, for instance unrepairable sweaters are shred and the fibers are used in India to make recycled yarn, clothes, or carpets.

Paragon’s gross revenue is only 20%, and it incurs 10 to 15% overhead expense.

“So, if we make 5 to 7%, that’s it. But it’s a comfortable living because of the volume,” Haji says.

He got his start when a cousin visiting him in LA from Congo in Africa propositioned him to find used clothing, sell, and ship to him overseas. Haji dabbled in unchartered territory, learning more from a friend with a clothing business in Canada who asked him for help finding LA suppliers of used clothes, and at the same time teaching Haji about the secondhand textiles market.

This was the start of a decades-long journey focused mainly on establishing and nurturing relationships to build a solid network.

“The first steps are to find a strong buyer in your overseas market and a good supplier with quality merchandise. You also need an established relationship with a freight forwarder who does transcontinental shipping,” he says.

Another key lesson in exports is you have to be diversified.

“There are a lot of ups and downs and political and economic instability in some of the regions where we work. But if business in one country is slow, we move product elsewhere.

And you have to find what’s in demand. Buyers pay ocean freight costs and duties, so you have to send what they want,” Haji says.

In his strongest market, that demand is for quality clothes—not raw materials or garments needing repair.

Paragon’s sister company, Casa de Ropa in Chile, warehouses what Paragon sends and distributes it to local microentrepreneurs, mainly women. Casa de Ropa helps them determine their target customers and recommends what they should buy.

“She takes bales home and might clean the clothes. She takes them to the flea market, displays and sells them,” Haji says.

Haji gambles sometimes in that if she seems serious, he sends her the product for a down payment, and almost always is paid back the balance.

“They are responsible and determined. So, we support her; slowly she grows. We no longer have to finance her because now she has a strong business. They come back and stay loyal because you put your neck out and trusted her, and now she is grateful to you,” Haji says.

Paragon’s model and merchandise work, he figures, because his brand represents America in the eyes of consumers. They see what intrigues them on social media and in Hollywood movies they watch on Netflix.

“What attracts them could be a t-shirt or other garment displaying a photo of Madonna or Michael Jordan, or the words “Nike” or “Florida … They love American fashion,” Haji says.

Born Primitive, a fitness apparel brand, sells overstock to Paragon at a deep discount.

“With Paragon’s help, we now have the ability to liquidate our inventory in a way that makes a positive social impact in less-privileged parts of the world, while also contributing to our company’s sustainability goals,” says Bear Handlon, owner and CEO of Born Primitive.

Paragon’s proposition struck a chord with Handlon, taking him back to an earlier day.

“We started our company out of our garage, and we went to countless events trying to sell t-shirts from a card table for the first few years. When I think about the people who will be purchasing our goods to make a profit for their own small businesses, it really comes full circle for me. They will essentially be doing what we did but in a totally different part of the world.”

Only recently has Handlon’s apparel business grown to the point where he is challenged to forecast precisely, and as a result ended up with overstock.

But overstock and return textiles inventory is common, especially for mid-sized and large retailers, where merchandise builds in their warehouses, often eventually making its way to landfills or getting burned.

“That's where we come in, giving another option, says Kay Litwin, Paragon Textiles manager of Partner Relations and Social Responsibility.

Paragon now retrieves about 10,000 to 20,000 pounds a month from a total of three retailers, which, like thrift shop finds, are shipped overseas. Litwin is trying to expand the retail end of the business – now only 5% of the mix – to build out Paragon’s model.

“Some people say, you are selling to these poor women? But for our overseas entrepreneurs, relying on donations would not be a long-term solution,” Litwin says.

“You need to assist countries in creating a sustainable economy rather than flood them with donations. Now these women can build a company and participate in a global market.”

What’s driven Haji?

“It’s like a two in one. As a private company if we do not make money, we can’t do what we are doing. But the beautiful thing is we are also doing a lot of good for the environment and helping entrepreneurs overseas.”",,[],[]
"Timmins holding household hazardous waste, textile collection","Single-use propane cylinders are just one of the many hazardous items the City of Timmins will collect during its annual household hazardous waste and textile collection event Saturday.

""You can’t really reuse those, so these are going to go where they should,"" said Marie-Eve Proulx, a resident who works to be eco-friendly.

During last year's collection, 54 tonnes of products that are unhealthy for the landfill were dropped off by residents, down from 70 tonnes the year before.

""It’s really important to bring these materials to be diverted properly and so that they’re either recycled into new materials or they’re properly brought into end of life, and so these materials don’t belong in our landfill. They don’t belong down the sanitary system because our wastewater facilities are not designed to treat these things,"" said Christina Beaton, the city's environmental coordinator.

Pesticides, batteries, electronics and paints are some of the other items that will be collected at the Archie Dillon Sportsplex on June 11 from 8 a.m. to 2 p.m.

""If you're unsure about what you can bring and what we will accept, you can check out the Timmins Recycling waste wizard,"" Beaton said.

A total of 5,000 pounds of textiles were amassed also amassed last year and Proulx appreciates that she is not the only one who cares about planet earth.

""It just makes sense to me. Like I like to spend time in nature and when you start feeling like you’re interconnected or part of the world, it just makes sense not to throw junk at it,"" she said.",,[],[]
How 3 Clothing Processers Are Reducing Textile Waste,"The clothing industry is a huge energy and water hog that accounts for about 4% of the world’s annual greenhouse gas emissions. While the slow fashion movement is starting to disrupt the industry, there is a dire need for ways to reduce textile waste. We identified three companies that are working to keep textiles out of landfills.

FABSCRAP: Collecting & Recycling Pre-consumer Textiles

Fabscrap processes pre-consumer fabric in the New York City and Philadelphia fashion industries. The company works with designers and entertainment companies to recycle and reuse fabric waste from the design process. This is a very small part of the waste associated with the clothing industry, says company founder Jessica Schreiber. But her company is not big enough to handle textile waste from the manufacturing process.

After Fabscrap picks up textile waste from its customers, volunteers sort it into the following categories: landfill waste, fabric that can be upcycled, or fabric that must be downcycled. Schreiber stressed that most textile waste is downcycled into shoddy. (Shoddy is low-quality material that manufacturers use for mattress stuffing, insulating, carpet padding, and other non-clothing purposes.)

Schreiber explains that most fabric consists of blended materials, in other words, a mix of synthetic and natural fibers. Because it’s too difficult to separate those fibers, clothing made of blended material is likely to be downcycled. Unless the fabric is made of a single fiber type, such as 100% cotton, it’s very hard to recycle old clothing into new clothing.

Fabscrap picks up 5,000 to 6,000 pounds of textile waste weekly, or approximately 260,000 pounds annually, and has over 8,000 volunteers to help with sorting. The company rewards volunteers with 5 pounds of fabric per work session. Fabscrap sells reusable fabric in its physical stores in New York City and Philadelphia.

Goodwill: Reusing Clothing Directly & Recycling the Rest

Goodwill Industries is a worldwide nonprofit organization that helps people improve their lives through job training, employment opportunities, and more. Some local Goodwill chapters also provide hot meals, financial literacy training, and childcare. You may be most familiar with the nonprofit through its regional thrift stores that sell inexpensive used clothing and home goods.

In 2020, the regional Goodwill Chapter of Greater Cleveland and East Central Ohio helped more than 819,000 people. It also deferred 18 million pounds of goods donated to its Goodwill stores from landfills. Four million pounds of those goods Goodwill either dedicated to an aftermarket program or recycled.

If clothing items don’t sell at a Goodwill store, the nonprofit offers them at its outlet stores where it sells textiles by the bin at just $1.59 per pound. Textiles that don’t sell at this second market are sorted into categories — rags, clothing, or linens — and baled. The aftermarket retailers who buy these bales often send the material to other countries where they are used to manufacture shoddy or downcycled into rags.

The Goodwill staff that we talked to stated that Goodwill prefers donations of undamaged textiles that it can sell in its stores. However, Goodwill does have this multi-step process to avoid the waste of any usable textiles.

ForDays: Circular Economy Fashion & Collecting Unwanted Clothing

Sustainable clothing brand ForDays works hard to close the textile waste loop by selling zero-waste clothing and accepting clothes for recycling.

ForDays reuses all of its manufacturing fabric waste in new ForDays clothing. The company also recycles the used ForDays clothing that customers return. It becomes fabric that ForDays uses to create new clothing collections. In addition, the company accepts clothing from any brand in any condition. To donate clothing, purchase a $20 Take Back Bag, fill it with clothing, and receive the $20 back as credit towards your next ForDays purchase.

ForDays clothing is zero waste because it is designed to be recycled. It is 100% organic cotton with minimal elastic and is easy to disassemble for recycling. When the company receives donated clothing made of blended material, it sells the fabric to manufacturers to make shoddy.

“At ForDays, we strongly believe that all fashion businesses must take responsibility for what happens to clothes after our customers love them and wear through them,” says ForDays CEO Kristy Caylor. “Our goal at ForDays was to figure out how to make participation in the circular economy an easy, seamless, and rewarding experience for all fashion lovers.”

Currently, ForDays accepts clothing for recycling only from the United States. The company has plans to expand the recycling program into Europe

How Consumers Can Help Reduce Textile Waste

While these are just a few of the many approaches that communities and companies can take to reduce textile waste, consumers must play a part too. Each of us can strive to buy secondhand, which means we are giving textiles a second chance. We can also reduce our overall clothing consumption and only purchase items we know we’ll wear many times. We can support sustainable clothing brands, buy quality clothing made of natural fibers, and care for it properly so it will last.

EarthDay.org has additional tips to help you sustainably shop for clothing. Consider shopping with retailers that recycle your clothing for you.",,[],[]
