title,text,summary,keywords,authors
PATAGONIA & HEIQ LAUNCH JOINTLY DEVELOPED NEXT GENERATION MINT-BASED TEXTILE ODOR CONTROL TECHNOLOGY,"ZÜRICH, June 15, 2022 /CNW/ -- HeiQ and Patagonia take their long-standing research collaboration to the next level and announce the launch of a jointly developed odor control technology for textiles, HeiQ Fresh MNT - renewably sourced mint oil-derived textile technology to control malodor development on textiles.

The long-standing research partnership between Patagonia and HeiQ resulted in yet another innovative solution for a problem on many textiles – malodor. Inspired by Patagonia's determination to continuously improve the chemistry used on all their products, the two pioneers announce the launch of HeiQ Fresh MNT, next generation sustainable odor control based on essential mint oil derived from a renewable and sustainable source.

The similar environmental and social philosophy shared between Patagonia and HeiQ was the backbone for the two brands to embark on an intense research partnership since 2015. Patagonia gives the ideas and sets the principles, HeiQ uses its expertise in specialty chemical formulation and application to textiles to create finishings that outperform the market in terms of sustainability and functionality.

Next Level Sustainable Odor Management

HeiQ Fresh MNT is the latest addition to the HeiQ Fresh family of sustainable odor management technologies, complementing the company's mineral-based HeiQ Fresh HAX and the bio-based HeiQ Fresh FFL. HeiQ Fresh MNT uses a renewable and responsibly sourced mint oil-derived textile technology to control malodor development on textiles, providing fabrics with a long-lasting odor control capability that keeps garments smelling fresh and wearers feeling clean and comfortable all day long. Based on test method ISO17299-3A using isovaleric acid, treated synthetic fibers more than double the odor control efficiency versus current industry standards.

HeiQ Co-founder and CEO, Carlo Centonze, says: ""Our partnership with Patagonia has always been productive as they constantly stretch our innovative capabilities. It therefore comes as no surprise that we were able to discover the powerful properties of mint as an active ingredient for our next generation odor control technology. HeiQ Fresh MNT is further confirmation of our dedication to enhance people's lives with sustainable innovation. With odor control you need to wash less, saving water, detergent, energy, microfiber and prolong the life of garments. We can all now look forward to a fresher smelling society with natural, reliable and durable odor control.""

Patagonia as first mover

Patagonia, as the development partner, is the first to commit to the technology and will start to upgrade its products in the near future.

Laura Hoch, Material Innovation Engineer from Patagonia, says: ""HeiQ is a valuable innovation partner and we're really excited about this technology. Not only does HeiQ Fresh MNT keep garments fresh in a sustainable way, it performs even better than what we currently use. We have been relentlessly testing this technology and lining up the supply chain to bring products enhanced with HeiQ Fresh MNT to the market as quickly as possible.""

About HeiQ

HeiQ HEIQ is a Swiss IP innovator and established global brand in materials and textile innovation. Founded in 2005 as a spin-off from the Swiss Federal Institute of Technology Zurich (ETH) and listed on the London Stock Exchange Main Market since 2020, HeiQ is focused on improving the lives of billions of people world-wide by adding hygiene, comfort, protection and sustainability to the products we use every day. HeiQ has strong IPs which are at the forefront of global technology. Active in multiple markets: textiles, carpets, antimicrobial plastics, conductive coatings, medical devices, probiotic household cleaners, personal care and hospital hygiene, HeiQ has created some of the most effective, durable and high-performance technologies in these markets today.

A trusted innovation partner for over 300 global brands and with a substantial R&D pipeline, HeiQ has won multiple awards such as the Swiss technology and the Swiss Environmental award and gained a strong reputation for the ESG and sustainable downstream effect of its innovations. HeiQ researches new solutions for partners, delivers scaled up manufacturing from its sites across the world and helps partners with go-to-market launches - aiming for lab to consumer in months. www.heiq.com

About Patagonia

Patagonia is a Certified Benefit Corporation based in Ventura, CA that is recognized internationally for product quality and environmental activism. Patagonia has contributed more than $145 million in grants and in-kind donations to date to grassroots non-profits working to protect people and the planet.

CONTACTS

HeiQ Materials AG

www.heiq.com info@heiq.com +41 56 250 68 50 Patagonia Media contact for interview or high-res image: Loraine Stantzos VP Marketing Communications loraine.stantzos@heiq.com Corey Simpson Product Communications corey.simpson@patagonia.com

View original content to download multimedia: https://www.prnewswire.com/news-releases/patagonia--heiq-launch-jointly-developed-next-generation-mint-based-textile-odor-control-technology-301567409.html

SOURCE HeiQ Materials AG

View original content to download multimedia: http://www.newswire.ca/en/releases/archive/June2022/15/c8464.html",,[],[]
Baldwin TexCoat G4 for Graniteville Specialty Fabrics,"Baldwin Technology has announced the installation of its state-of-the-art TexCoat G4 finishing system at Graniteville Specialty Fabrics, a recognized leader in the production of specialty coatings and coated fabrics. With Baldwin’s cost-efficient and highly sustainable spray finishing technology, Graniteville Specialty Fabrics has been able to increase production efficiency, and minimize chemical and water waste.

Based in Graniteville, South Carolina, Graniteville Specialty Fabrics produces coatings and coated fabrics that are resistant to water, fire, UV and weather for the military, marine and tent markets, and others. The company excels in developing and sourcing custom coatings, and creating specialized technical solutions to meet specific, and often unique, end-user requirements. The installation of Baldwin’s TexCoat G4 is part of a major facility upgrade to maximize production efficiency and capacity in the durable water-repellent finishing and coating line to meet growing customer demand for advanced engineered products.

With extensive sustainability benefits, unprecedented tracking and process control, and Industry 4.0 integration, the TexCoat G4 provides consistently high-quality fabric finishing, with no chemistry waste, as well as minimal water and energy consumption. The system utilizes non-contact precision-spray technology, ensuring precise finishing coverage with the exact amount of chemistry for reaching the optimal performance of the fabric. Changeovers (pad bath emptying, cleaning and refilling) are significantly reduced, resulting in substantial chemical conservation and increased productivity.

“We are pleased to be a key partner in Graniteville Specialty Fabrics’ modernization project,” said Rick Stanford, Baldwin’s Vice President of Global Business Development, Textiles. “The team reached out to us, and it was clear that the TexCoat G4 was the right tool to help them minimize waste and increase productivity.”

Doug Johnson, Graniteville Specialty Fabrics’ Executive Vice President of Development and Technical Services, said the company needed to increase its productivity and sustainability, without sacrificing fabric quality and performance.

“Anytime you change from a traditional process like padding, it is human nature to be a little sceptical,” said Johnson. “Baldwin organized production-scale trials for us at a nearby TexCoat-equipped factory. We took the finished fabric and scrutinized the look and feel and performed a battery of tests in our lab to American Association of Textile Chemists and Colorists spray-rating and hydrostatic-head standards. The results were impressive. Moreover, when we commissioned our TexCoat, we duplicated and exceeded the fabric performance realized during the trials.”

www.baldwintech.com

www.bwforsyth.com",,[],[]
"Inspired by spiders, one Japanese startup is inventing a new generation of textiles","(CNN) Five times stronger than steel , spider silk's unique qualities were recognized by the Ancient Greeks — and more recently, scientists have looked at applications from medicine to engineering.

Now,one Japanese startup, Spiber , is exploring how spider webs could transform the textile industry. The biotech company started by making a spider silk replica in the lab and has since spun out its fabric range to include more sustainable alternatives to wool, cashmere and denim, says Kenji Higashi, head of business development at Spiber.

The company's trademarked fiber, Brewed Protein, has been used in limited edition collections with brands including Japanese streetwear label Sacai and outdoor apparel specialists The North Face Japan.

Currently scaling up production and getting ready for a full commercial launch of its textiles, Spiber hopes its technology will help to ""solve some of the big global challenges that we're facing,"" says Higashi.

Fermenting fabrics

Spiders create webs by spinning liquid protein into silk. Although silkworms have been bred to produce silk for thousands of years, spiders are cannibals which makes them impossible to farm.

That's why friends Kazuhide Sekiyama and Junichi Sugahara, Spiber's founders, decided to create a synthetic material that is molecularly identical to spider silk. The duo began experimenting as students at Keio University in Yamagata Prefecture in 2004, and founded the company in 2007.

Spiber studied ""thousands of different spider species,"" as well as other silk-producing species, and compiled a database of silk varieties, says Higashi.

The Brewed Protein polymer powder is fermented with water, sugar, and specially-designed microbes. After being refined, this powder can be processed into a variety of fabrics, such as leather, silk, or spun yarn.

Having successfully produced the spider silk alternative, the team went on to develop a range of Brewed Protein fabrics by altering the protein sequence, says Higashi.

Spiber's fibers are made by fermenting water, sugar and nutrients with specially modified microbes in steel tanks, similar to those used in beer making, to produce protein polymers. The polymers are fed through a nozzle and spun into a fiber, says Higashi.

It hasn't been an easy journey, though. In 2015, Spiber partnered with The North Face Japan to produce a limited-edition run of 50 ""Moon Parka"" jackets to commemorate the 50th anniversary of the moon landings.

But during the design process, the team discovered that spider silk shrinks when wet, and had to modify the protein to make the fiber suitable for an outdoor jacket.

It took four years ""to produce a garment that met their standards,"" says Higashi. The parkas retailed for ¥150,000 (worth around $1,400 in 2019) and the small collection sold out.

A recycling revolution

Spiber uses robotics in its factory to help with the production of its spider silk-inspired fiber.

Higashi says Spiber's biodegradable textiles are predicted to generate just one-fifth of the carbon emissions of animal-based fibers once they are in full-scale production, according to a life cycle analysis conducted by the company.

Spiber wants to reduce its environmental impact further, though. The company currently uses sugarcane and corn for its fermentation process — crops that use large volumes of land and divert food resources, says Higashi.

To resolve this, Spiber is developing a process called ""biosphere circulation"" that will convert discarded garments made from natural materials like cotton into the sugars needed for fermentation.

Around 40 million metric tons of textile waste is produced every year and most of this goes to landfills or incinerators: keeping these textiles in the loop could create a more sustainable alternative, says Higashi.

Global expansion

Spiber isn't the only company taking inspiration from arachnids. In 2016, Adidas incorporated AMSilk's Biosteel fiber in a sneaker and in 2017, California textile innovator Bolt Threads unveiled its spider-silk-inspired thread, Microsilk, in a gold dress designed by Stella McCartney.

In addition to its collaborations with The North Face Japan, Spiber's Brewed Protein has been used by Japanese designer Yuima Nakazato for several of his collections, and streetwear brand Sacai for a limited-edition T-shirt range. Higashi says Spiber is exploring opportunities in the automotive industry, too.

In 2021, fashion designer Yuima Nakazato showcased a collection at Paris Fashion Week Haute Couture that featured a blue, shiny textile made from Brewed Protein fibers and silk.

According to the company, Spiber has raised around ¥100 billion ($783 million) from investors including finance firms Carlyle and Mitsubishi UFJ Morgan Stanley Securities, along with grants from government organizations and startup development funds.

This funding will allow the company to expand beyond its pilot plant in Yamagata — opening a small plant in Thailand later this year, and a larger facility in the US next year in a partnership with food processing multinational Archer Daniels Midland Company. Higashi says this will enable production of thousands of tons of Brewed Protein over the next few years.

Higashi says scaling will help bring the price of Brewed Protein down and allow Spiber to expand beyond the high-end designer market.

""We have the means to create solutions to enable more circular fashion,"" says Higashi. ""It's our mission to bring those solutions to the world.""",,[],"['Rebecca Cairns', 'Cnn Business']"
